,Title,Job Description,Compnay Name,Location,Degree Type,Skills
234,School Human Resources Administrator,"person specification• minimum bachelor’s degree• over 8 years’ experience working within a school• up to 3 years’ experience in an administrative leadership position within a school• excellent written and verbal communication skills• ability to communicate effectively at all levels of the organization • excellent relationship management skills• proficient in the use of ms office • excellent interpersonal skills• good leadership skills and ability to coordinate team to achieve set objectives• good problem solving and decision-making skills• evidence of personal commitment to professional development• excellence in service delivery, focus on quality and attention to detail• ability to multitask, prioritize and meet deadlines on a consistent basisyou may be required to carry out other duties which may arise from time to timehighly qualified people needed",jobilate,Lagos,"ma, bachelor, nce","HR payroll system,HRM knowledge, recruitment and selection, HR analytics,"
235,Hotel Manager,hotel manager /sales officer needed urgently,Chariot Development Limited,Lagos,ma,"financial management,food nd beverage management, sales and marketing sills,human resource management, hotel operations competency"
237,Graduate Trainee,"graduate trainees are fresh graduates who are transitioning into a workplace so that they gain some work experience. graduate trainees' responsibilities depend on their industry, but they are generally guided by a senior staff member as they learn, train, and attend meetings. graduate trainees usually have a degree related to the work they are being trained in.graduate trainee job description should contain a variety of functions and roles including:gathering as much information on the company and participating in on-the-job training wherever possible.participating in meetings, workshops, and team-building events.bringing positive energy into the company, and forming lasting professional relationships with staff.conducting research and assisting the manager or supervisor wherever possible.completing fieldwork or visiting different work sites when required.taking notes on experiences and keeping a log of things learned.compiling reports and making presentations to other staff members.analyzing existing systems and offering new ideas for improvement.upholding the good name of the company at all times.writing a test or submitting to some other form of evaluation at the end of the graduate program.job originally posted on grabjobs. if you need to report this job please contact grabjobs",Creedlink Resource Firm,Bayelsa,"ond, ma, mpa, nce","leadership, self-motivated, management skills, analytical skills, communication skills"
238,Station Manager,"never miss a job update again. company: location: nigeriastate: job type: full-time job category:  job descriptionprivate airlines services limited (operators of united nigeria) is a wholly nigerian company incorporated under the companies and allied matters act of 1990 at the corporate affairs commission to offer commercial air transportation services under the registered tradename; united nigeria.we are recruiting to fill the position belowjob title: station managerlocation: osubi, deltaemployment type: full timereports to: head ground operation (hgo)job descriptionthe station manager is to ensure on time performance of all domestic, regional and international flights, transit passenger, baggage, cargo and aircraft activities with the highest standard of service and efficiency rendered to passengers and customers of the airlines with safety, security and on-time departure being top priority.key responsibilitiesoversees all aspects of the station’s operations ensuring safe, punctual, efficient and smooth operations.assumes direct responsibility for his station agents, customer service agent, security staff, ticketing and reservation officers, dispatcher, ramp agent, driver, catering officer) check- in agent and baggage handlers etc)directs all activities related to station operations and coordinates all functions to ensure superior customer service, operational integrity, and positive employee relations.develops schedules ensuring cost compliance and allocating needed resourcesensures customer service representatives are fully trained, knowledgeable and provide superior customer service.ensures compliance with all una ground operation’s manual, load manual, station manuals and other documents relevant to the management of the station.ensures compliance with international, federal, state and local aviation regulationsidentifies and manages station problems, investigate and provides recommendations for operational efficiency for managementmakes yearly plans and budgets for the station. negotiates and manages airport specific contracts, quotations and follows up service compliance in accordance to the existing contracts.initiates service recovery efforts in the event of operations irregularities in cooperation with operational dispatch.verifies and approves all station related invoices and reports any mistakes accordingly.involves in station staff recruitment, initiatives disciplinary hearings, training, development and motivational exercises for station staffprovides leadership and guidance to the ground handling agents and una staffrepresents una at all airport related functions, meetings and liaises with airport authority and governmental offices.ensures company brand and values complianceperforms any other duties that may be assigned by management from time to time.ensures having meetings with his teamensures team work in the stationmaintain excellent relationship with aviation authorities-ncaa,faan,nama and nimet and others-bankers, hotel, car hires etccomplete quarterly and annual appraisal and staff assessment and make recommendations and submit to hgo.submit to faan,nama,ncaa all relevant official documents required by regulationeducation & physical requirementshnd or b.sc in any disciplinea higher degree will be an added advantage.must be able to work late hours and multi task.a minimum of four (5) years’ experience as a station managermust be comfortable to work under extreme pressuremust be smart enough to take critical decisions within very short time limirequired skills & abilitiesstrong customer service skillsknowledge of nig.carsknowledge of ground handling operations will be of advantageability to develop working partnerships with all departments and other airlines at the airportanalytical and forward lookingtechnical expertise — mastery of job-related knowledge, skills and abilitiesadaptabilitypersuasiveteam playeranticipation and prioritization abilitiesmust be very meticulous with eyes for details.must have leadership and motivational skillsdirecting and developing staffrelationship building skillsinterpersonal skillst.application closing datenot specified.don't keep! kindly share:",United Nigeria Airlines,Delta,"ma, hnd, b.sc, mpa, nce","CPR, Time management, Multitasking, Tech savvy, Human resource management"
269,Administrative Logistics officer,"job title: logistics administrative officer role profile reports to the logistics manager  department: logistics  location; sagamu ogun state job description the logistics ad officer will be responsible for providing logistic support and overseeing the overall logistic processes in support of the objectives of the organization. he/she will also serve as office backups for the entire logistics team, reporting daily activities to the logistics manager. key responsibilities follow up on documentation related to shipments, by processing export documentation when the need arises  ensure compliance of the freight forwarding processes with company rules and all applicable laws and regulation  ensure the good administration and filing of all the freight forwarding documents in line with the applicable procedures  liaise with other logistics team, warehousing personnel to ensure efficient operations for shipments.  update shipping register by entering relevant information and updates on shipments and timelines  ensure appropriate and correct shipping documents are obtained from the freight forwarders, banks, government appointed pre-shipment inspection agents’  ensure adequate record keeping of customs documents, notices, government regulatory documents and documentations of other third parties.  apply nxp online and liaise with banks for approvals  preparation of pre shipment and post-shipment docs  liaise with shipping lines for shipping booking, vessel schedules etc  follow up with agent for gate in of containers  filling of shipping instructions before si cutoffs in coordination with supplier  checking of terminal charges, shipping charges and freight invoices. required academic & technical qualifications candidates should possess a bsc / hnd qualification in any related field  certificates courses related to logistics will be an added advantage  marketing the role  stable employment in an international organization  collaborative atmosphere with like-minded individuals who are passionate about cocoa and chocolate.  the ability to grow your career within an organization that values development and internal career growth essential experience / knowledge 2- 4 years’ experience in similar role  proficiency use of ms office  must have a thorough understanding of ms office applications and logistics software necessary to conduct research and complete routine/moderately complex tasks  must be able to assess moderately complex information from multiple sources and draw logical conclusions.  can establish and preserve productive partnerships with clients by gaining their trust and respect, as well as nurture an effective working relationship with the work team.  must be able to communicate with various stakeholders, including customers, colleagues, vendors, etc. it is also vital for composing and delivering.  must be able to plan, prioritize, and manage their own activities and office workflow even when working under tight deadlines.  must have a customer focus attitude.  must be willing and able to adapt to changing work requirements and priorities that may require overtime or extended hours.  knowledge across all the disciplines of supply chain management will be an added advantage.  reference in shipping line and terminals, son and nafdac will be added advantage.",Barry Callebaut Group,Lagos,"ma, hnd, ond, mpa, bsc, nce","Microsoft office, customer service, Training "
277,Marketing Manager,"never miss a job update again. company: location: nigeriastate: job type: full-time job category:  job descriptionfadac resources and services – our clients in various sectors are recruiting suitably qualified candidates to fill the following positions below: warehouse picker location: lagosdeadline: 15th december, 2021. estate executive location: lagosdeadline: 30th november, 2021. account manager location: lagosdeadline: 30th november, 2021. recruitment associate location: lagossalary: n720,000 annuallydeadline: 30th november, 2021.don't keep! kindly share:",Fadac Resources and Services,Lagos,"mpa, ma","Data analysis, SEO, Tech savvy, Flexibility, Content creation."
278,Front Desk Officer,"never miss a job update again. company: location: nigeriastate: job type: full-time job category:  job descriptiongeorge houston resources limited (ghr) is a human resource development and management consulting firm. we assist organizations to achieve their corporate visions and objectives through integrated, strategic and solution-oriented hr consulting services using best-practice methodologies.we are recruiting to fill the position belowjob title: front desk officerlocation: lekki, lagosemployment type: full-timeindustry: real estaterequirementscandidates should possess hnd / b.sc qualification.1 – 2 years work experience.salaryn70,000 monthly.application closing date12th november, 2021.don't keep! kindly share:",George Houston Resources Limited,Lagos,"ma, hnd, b.sc, mpa, nce","manning the switchboard, receiving, endorsing letters, MS Office applications, accounting softwares"
301,Graduate Trainee,"graduate trainee responsibilitiesgathering as much information on the company and participating in on-the-job training wherever possible.participating in meetings, workshops, and team-building events.taking notes on experiences and keeping a log of things learned.compiling reports and making presentations to other staff members.analyzing existing systems and offering new ideas for improvement.bringing positive energy into the company, and forming lasting professional relationships with staff.conducting research and assisting the manager or supervisor wherever possible.completing fieldwork or visiting different work sites when required.upholding the good name of the company at all times.writing a test or submitting to some other form of evaluation at the end of the graduate program.job originally posted on grabjobs. if you need to report this job please contact grabjobs",Creedlink,Bayelsa,"ond, ma, mpa, nce","leadership, self-motivated, management skills, analytical skills, communication skills"
307,Graduate Trainee,"the robotics centre,an artificial intelligence and robotics company is looking to hire smart,innovative,creative,tech savy individuals to be a part of the team for the roles below:1.business development 2.marketing/social media management 3.industrial trainees ( undergraduate/ond graduates)requirements:0-2 years work experience bsc/hnd/ond in relevant discipline corps members are eligible to apply for it :ond graduates and undergraduates in engineering are eligible to apply qualified and interested candidates should send cv to oluchi@roboticscentre.org using the job title as subject of the mail.kindly share !!",Robotics Centre limited,Lagos,"ma, hnd, ond, mpa, bsc, nce","leadership, self-motivated, management skills, analytical skills, communication skills"
309,Head Of Business,"job title: head of businessindustry: aviation / travel management companylocation: lekkijob summaryin order to be considered, you will need to be a highly professional and strategically minded individual, possessing the patience and persistence to work across sometimes lengthy sales and operations cycles.objectives of this rolestrategize, implement, and oversee processes for increased productivity and growthdesign daily operational programs that produce organizational objectivesmanage employee activities, providing suitable resourcesestablish and grow relationships with appropriate partnersestablish cost parameters and manage the overall p&l of this company / divisionmaintain a forecast and targeting sales attainment plandaily and monthly responsibilitiessupervise employee production and counsel toward improved efficiency with internal processes that adhere to legal guidelinesprovide appropriate data analytics of sales and distributors and partners to appropriate management teamswork with assistant managers to develop long-term strategic initiativescreate and maintain rolling 3-month sales forecast and targeting sales attainment plansparticipate in competitive analysis and pricing strategy developmentsupport customer-facing operations, including sales, marketing, and public relationsskills and qualificationsbachelor’s degree in business, management, or related fieldat least 3 years experience as a business manager or relevant managerial roleproven experience with business and strategy development processesoutstanding poise in a fast-paced business environmentsuperior leadership skills, with a focus in employee coaching and developmentmaster’s degree in business, management, or related fieldstrong capabilities with database and information systems softwareprevious data analysis experienceproven ability with financial and budgetary processesprior industry experience and up-to-date knowledge of relevant trendssalary: n300,000 - n500,000interested and qualified candidates should send their cv to: info@hrbreakoutroom.com using the job title as the subject of the mail.",HRbreakoutroom,Lagos,"ma, bachelor, mma, mpa, nce","Finance, Project management, Negotiating, Logistics, Business knowledge."
311,Partner Operations Intern,"we are looking for a great candidate to fill the position of a partner operations intern. are you after a role in a fast-growing organisation with big impact on the city you live in? then this one might be for you.your daily adventure will include operational management of restaurant profiles on bolt food platformprocessing requests from the restaurants in the internal system  helping with creating the visual side of food deliverycreating a fun, inclusive, fair, but results-driven culturejob requirementsstrong skills in excelproactive approach and high degree of independenceattention to details and diligencebe passionate about new technologies and food tech",Bolt,Lagos,"mpa, ma, nce","Excel, Analytics, Tech savvy, Research and analysis, Critical thinking."
312,Territory Sales Manager,"never miss a job update again. company: location: nigeriastate: job type: full-time job category:  job descriptionblume nigeria limitedis a privately owned international trading and distribution company. our management has many years experience in the fields of production, importing and distributing of foods products. blume is a member of sonia foods industries limited, the manufacturer of sonia food products.we are recruiting to fill the following positions below sales promoter (lagos) salary: n40,000 – n100,000 monthly.deadline: 15th november, 2021. sales promoter (oyo) deadline: 10th november, 2021.  modern market sales promoter location: lagosdeadline: 10th november, 2021. assistant sales coordinator location: lagosdeadline: 10th november, 2021.don't keep! kindly share:",Blume Nigeria Limited,Lagos,"mpa, ma, nce","Microsoft office programs, Consumer sales technique, Sales planning, Analytics, Multitasking."
313,Sales Officer,"*vacancy!!!* our client, an internet service provider (isp)  with branches all over the nation, is recruiting to fill the position below:location *abuja* job title: *sale manager (fixed line)* salary: 300k *duties and responsibilities:* • work with director of sales on marketing plan •conduct sales meetings with clients •developing sales pitches and materials using self-conducted market analysis • cold calling in designated coverage cluster • generate leads and manage funnel of hot/warm/cold calls for sales  •develop, build, and manage a client base • handle the sales process at each stage from quote to purchasing to fulfillment and follow up  *requirements* • bachelor’s degree in business administration, business management, statistics or a related field. • proven experience in telecom/isp/ • minimum of 5 years in a supervisory position •proven track record of increasing sales and revenue; field sales experience is preferred 5) ability to develop sales strategies and use performance kpis• proficient in ms excel/word, ppt 7) excellent )• senior person with over 5years experience from ipnx or isn, telecom/isp industry will be added advantage.qualified candidates should forward cvs using the subject and location to lorachevacancy@gmail.com",LORACHE CONSULTING,Abuja,"ond, ma, bachelor, nce","Product knowledge, Business communication, Social selling, Conflict management and resolution, Client engagement."
314,Investor Relation Manager,"never miss a job update again. company: location: nigeriastate: job type: full-time job category:  job descriptionprowedge limited is currently recruiting suitably qualified candidates on behalf of its clients in various sectors to fill the following positions below graphic design intern location: lagossalary: n30,000 – n80,000 monthly.deadline: 26th november, 2021. investor relations manager location: lagosdeadline: 26th november, 2021. admin supervisor location: lagosdeadline: 18th november, 2021. elementary (primary school) teacher location: lagosdeadline: not specified. college (secondary school) english language / literature-in-english teacher location: lagosdeadline: not specified. special needs therapist location: lagosdeadline: not specified. college principal location: lagosdeadline: not specified. driver location: lagosslot: 4 openingsdeadline: 16th november, 2021. caregiver location: lagosslot: 4 openingsdeadline: 16th november, 2021. school nurse location: lagosslot: 4 openingsdeadline: 16th november, 2021. accountant location: lagosslot: 4 openingsdeadline: 16th november, 2021.don't keep! kindly share:",Prowedge Limited,Lagos,"ond, mpa, ma","Data analysis, Presentation and visualization, Information collection, Financial modeling, Equity research."
396,Administrative assistant,"we are looking for a master multi-tasker with excellent communication skills and an upbeat attitude. candidates should be able to assist management and all visitors to the company by handling office tasks, providing polite and professional assistance via phone, mail, and e-mail, making reservations or travel arrangements, and generally being a helpful and positive presence in the workplace.to be successful as an administrative assistant, candidates should be professional, polite, and attentive while also being accurate. they should always be prepared and responsive, willing to meet each challenge directly. administrative assistants must be comfortable with computers, general office tasks, and excel at both verbal and written communication. most importantly, administrative assistants should have a genuine desire to meet the needs of others.administrative assistant responsibilitieshandling office tasks, such as filing, generating reports and presentations, setting up for meetings, and reordering supplies.providing real-time scheduling support by booking appointments and preventing conflicts.making travel arrangements, such as booking flights, cars, and making hotel and restaurant reservations.screening phone calls and routing callers to the appropriate party.using computers to generate reports, transcribe minutes from meetings, create presentations, and conduct research.greet and assist visitors.maintain polite and professional communication via phone, e-mail, and mail.anticipate the needs of others in order to ensure their seamless and positive experience.administrative assistant requirementsond/hnd/bsc in a related field.prior administrative experience.excellent computer skills, especially typing.attention to detail.desire to be proactive and create a positive experience for others.job originally posted on grabjobs. if you need to report this job please contact grabjobs",Delacrust Consult,Bayelsa,"ma, hnd, ond, mpa, bsc, nce","IT Operations,IT Management, Business Management"
397,Cashier,"never miss a job update again. company: location: nigeriastate: job type: full-time job category:  job descriptionnennetworks – our client, a renowned fmcg company known for providing fast food services across lagos state, is recruiting to fill the position belowjob title: cashierlocation: ajah, lagosemployment type: full-timeresponsibilitiesmanage transactions with customers using cash registersscan goods and ensure pricing is accuratecollect payments whether in cash or creditissue receipts, refunds, changes or ticketsredeem stamps and couponscross-sell products and introduce new onesresolve customer complaints, guide them and provide relevant informationgreet customers when entering or leaving the storemaintain clean and tidy checkout areastrack transactions on balance sheets and report any discrepanciesbag, box or gift-wrap packageshandle merchandise returns and exchanges. requirementsssce / ond with 1 – 2 years of works experience.work experience as a retail cashier or in a similar role in salesbasic pc knowledgestrong communication and time management skillscustomer satisfaction-oriented.salaryn30,000 – n40,000 monthly.application closing date30th november, 2021.don't keep! kindly share:",NENnetworks,Lagos,"ma, ssce, ond, n cle, mpa, ma, nce","Point Of Sale(POS) Systems, Multitasking, Basic Maths skills, Efficiency, Product Knowledge"
401,Social Media Coordinator,"the ideal candidate will create and maintain a strong online presence for our company. they will implement online marketing strategies through social media accounts in an effort to increase brand awareness. additionally, this individual will understand the target audience and create an appropriate strategy to reach this group.  responsibilitiesresearch target audience and discover current trendscreate engaging text, video, and image contentdevelop optimal posting scheduleshould be able to travel back and forth to victoria island qualificationsbasic graphic designing skillsexperience as a social media coordinatorstrong communication, multitasking, time management and analytical skills",SocialTraction,Lagos,"ma, mpa, nce","Social content management systems,analytical,project management,graphic designing"
