,Title,Job Description,Compnay Name,Location,Degree Type,Skills
110,Graduate Energy Accounting Officer,"never miss a job update again. company: location: nigeriastate: job type: full-time job category:  job descriptionikeja electricity distribution company (ikedc) – buoyed by a mission to redefine customer experience and be the provider of choice wherever energy is consumed, the ikeja electric (ie), nigeria’s largest power distribution network, came into existence on november 1st, 2013 following the handover of the defunct power holding company of nigeria (phcn) to nedc/ kepco consortium under the privatization scheme of the federal government of nigeria.we are recruiting to fill the following positions below graduate energy accounting officer location: lagosdeadline: 31st july, 2021. graduate vigilance strategy & monitoring officer location: lagosdeadline: 2nd august, 2021. graduate store officer location: lagosdeadline: 29th july, 2021. graduate it helpdesk officer location: lagosdeadline: 28th july, 2021. finance & administration manager location: lagosdeadline: 4th august, 2021.don't keep! kindly share:",Ikeja Electric,Lagos,"mpa, ma, nce","Analytical Skill, Health and Safety skills, Business Intelligence, data analysis, accounting and auditing"
111,Finance Manager,"reporting to the cfo, the finance manager role is responsible for the maintenance of accounting records, financial management/reporting, and forecasting, business advisory, including oversight and leadership functions in the finance department.he/she will have oversight of the finance department including reporting and variance analysis, provide commercial information across the business, constantly seeking to add value, contributing to the budgeting, and forecasting process and a range of ad hoc tasks and projects key to business success job descriptionprovide financial reports and interpret financial information for both internal and external stakeholdersprovide technical and administrative leadership for operational accounting activities (a/r, a/p, billing, gl integrity, business advisory, cost accounting and tax administrationcoordinate and direct the preparation of the budget and financial forecasts and report variancesprovide financial management and controlling services to the specific business area(s) across several functions/departmentsprepare and publish timely monthly, quarterly, and annual financial statements for both internal and external stakeholders. coordinate the preparation of regulatory reportingensuring company financial systems are robust, complaint as well as supporting future business growth, including both organic growth and acquisitions.work closely with the senior management team to strategize, analyze, and manage, ensuring finance are involved in key business decisions. introduce and steer innovations in existing financial processes, systems, and methods for enhanced effectiveness and efficiencymanaging the company’s accounting function including weekly and monthly reports, consolidated accounts and presenting annual accounts to the cfomanaging policies regarding capital requirements, debt, taxation, equity, disposals, and acquisitions etcimprove and implement where necessary systems and processes across all finance streams (invoice management, revenue management, payroll, budgeting and controlling, tax etc)financial controlling: budgeting, planning costs etc.requirements·      university degree in accounting or a related field. ·      professional qualification – ican, acca, cfa etc. ·      at least 6-7 years in progressively finance roles financial/technology organizations (previous finance leadership experience)·      experience interfacing and operating with senior executives in public, government, and private sectors. ability to challenge and provide feedback in a constructive manner with the goal of improving efficiency and operational excellence.·      flexible, adaptable, and able to execute a range of job duties and changing priorities.·      possess excellent verbal, written, and presentation skills with the ability to articulate information to a variety of constituents across cultures.·      experience building capabilities and capacity of accounting and operations teams in high growth organizations.·      basic appreciation: operate accounting systems, generate routine accounting records and financial reports.·      working knowledge:·      determine and apply correct accounting treatments.·      able to identify & mitigate operational, financial and business risks.·      manage operational internal control systems, processes, and policies.·      financial processes & accounting operations management.·      management & financial reporting including financial forecasting & budgeting.·      demonstrated people management and leadership capabilities in a fast-growing organization.·      ability to assess risks and exercise judgment in making important decisions (risk management & internal controls management).·      ability to influence senior executives internally and externally and manage the pressure of work.·      ability to lead through complexity; lead enormous work volume, manage organizational risks, and recommend appropriate decisions.·      demonstrated initiative and drive towards innovative problem solving.·      honed business partnership skills with impeccable integrity.·      ability to assess risks and exercise judgment in making important decisions.",Africa Prudential Plc,Lagos,"ma, s succe, mpa, nce","forecasting, Strategic planning, Business development, statistical modeling software and spreadsheets, Budget management"
112,Head Of Business Operations,"gwcu canada ltd, a lending organization is interested in employing a head of operations with 3-5yrs work experience in its abuja office. s/he is to perform a variety of duties including:provide overall leadership and direction to the operations team by ensuring that the department’s activities are effectively coordinated nationwide. formulate and facilitate the implementation of strategies that ensure the effectiveness and efficiency of operational processes, to support the organization’s transactions and activities occasional trips out of abuja.click this link to get more details of job requirements: https://tinyurl.com/head-of-operations   interested applicants must have a background in either business administration/ business management or any relevant social science field and be resident in abuja. possession of a master’s degree in business administration will be an added advantage.  must possesses good knowledge of general business operations and finance processes, practices, theories, and policies for a lending organization.  proficiency in microsoft excel, microsoft powerpoint, and microsoft word is very important. experience in a similar head of operations role for a financial institution will be an added advantage. to apply complete this link with personal details: https://tinyurl.com/hop-application-form application deadline: october 27, 2021",GWCU CANADA LTD,Abuja,"ma, ma, nce","Interpersonal skills, risk assessment and analysis, strategic thinking, budget development, data processing"
120,Waste Management Operator,"never miss a job update again. company: location: nigeriastate: job type: full-time job category:  job descriptionpadua petroleum nigeria limited (ppnl) is an indigenous company established to provide a unique range of services to the nigerian oil and gas industry. we venture into this industry with the objective of building on existing limited in- country capacity. in view of the enormous opportunities which abound in the oil and gas industry in nigeria and the new findings in other african countries, there is need for more indigenous players to fill the yawning gap by providing competitiveness and quality service delivery to the industry.we are recruiting to fill the position belowjob title: waste management operatorlocation: lagosemployment type: contractqualifications and experiencebachelor’s degree in geography or environmental sciences.at least 5 years relevant experience in a similar role in the oil & gas industryhse professional qualification is requiredrelevant certifications will be a definite added advantageability to perform and document various tests required by state and federal agencies for the operation of waste disposal/ sewage treatment.perform daily checks of waste management process and periodic checks of pump stations.have a working knowledge of the operation, methods and procedures of a sewage treatment plant.have a working knowledge of the machinery used for sewage treatment and pumping stations.have a thorough knowledge of mechanical equipment and the ability to diagnose and correct equipment malfunction. have a working knowledge of basic machinery preventive maintenance and repair.have a basic knowledge of state and federal rules governing waste disposal and worker’s safety.experience in hse documentation/project documentation. (hazop, hazid, qualitative risk assessment, incident investigation & audits).ability to operate and maintain waste equipment and systems.required competenciescontract administration skillsdocument management skillscommunication skillsreport writing skills.application closing date26th october, 2021.don't keep! kindly share:",Padua Petroleum Nigeria Limited (PPNL),Lagos,"ma, bachelor, mpa, ma, nce","Attention to details, team work, waste management, report writng skills, Administrative skills"
121,Water Treatment Plant Operator,"never miss a job update again. company: location: nigeriastate: job type: full-time job category:  job descriptionpadua petroleum nigeria limited (ppnl) is an indigenous company established to provide a unique range of services to the nigerian oil and gas industry. we venture into this industry with the objective of building on existing limited in- country capacity. in view of the enormous opportunities which abound in the oil and gas industry in nigeria and the new findings in other african countries, there is need for more indigenous players to fill the yawning gap by providing competitiveness and quality service delivery to the industry.we are recruiting to fill the position belowjob title: water treatment plant operatorlocation: lagosemployment type: contractrequired qualifications / experiencebachelor’s degree in sciences / social sciences e.g. chemical engineering/ occupational healthmaster’s degree in occupational health, safety and environment will be an added advantagemaster’s degree in occupational health, safety and environment will be an added advantageat least 5 years’ relevant experience in a similar role in the oil & gas industryhse professional qualification is requiredadditional related qualifications will be a definite added advantageability to perform daily checks of the water treatment process and periodic checks of pump stations.have a working knowledge of the operation, methods and procedures of a water treatment plant.have a working knowledge of the machinery used for water treatment and pumping stations.have a thorough knowledge of mechanical equipment and the ability to diagnose and correct equipment malfunction.have a working knowledge of basic machinery preventive maintenance and repair.have a basic knowledge of regulatory rules governing water discharges and worker’s safetyexperience in hse documentation/project documentation(hazop, hazid, qualitative risk assessment, incident investigation & audits).ability to operate and maintain water equipment and systemscompetencecontract administration skillsdocument management skillscommunication skillsreport writing skillsapplication closing date26th october, 2021.don't keep! kindly share:",Padua Petroleum Nigeria Limited,Lagos,"ma, bachelor, msc, mpa, nce","risk assessment, mechanical skills, instrument operations, judgement and decision making skills, troubleshooting"
126,"Associate Product Marketing Manager, Platforms and Ecosystems","minimum qualifications:bachelor's degree or equivalent practical experience.experience in marketing, brand management, business consulting, strategy consulting, agency, or related.experience in managing partnerships.preferred qualifications:demonstrated analytical experience. understanding of google's products, marketing as a discipline and ability to develop frameworks for a solid marketing storytelling.demonstrated ability for developing and understanding strategy.global mindset and ability to think across disciplines, industries, cultures, and scenarios. ability to manage and coordinate projects that span multiple locations.interest for technology, ability to ""think outside the box”, and leadership ability to execute effectively.great communications skills.about the jobwhether you're on a consumer product (like gmail, search, maps, chrome, android) or a business product (google ads, adsense, google marketing platform, analytics), you take part in a complete marketing experience as you lead every facet of the product's journey. from determining positioning, naming, competitive analysis, feature prioritization and external communications, you help shape the voice of the product and help it grow a consumer base. this means you work with a cross-functional team across sales, corporate communications, legal, webmasters, product development, engineering and more. in this role, you'll be involved with product marketing strategy from beginning to end.as an associate product marketing manager on the sub saharan africa access marketing team, you will work to solve access barriers for more people to access the internet and get online across the region. you will work with diverse partners from carriers and original equipment manufacturers (oems) to telco partners. you'll deliver campaigns including training that drives usage of google workspace and support our cross-functional teams to build scaled approaches to engage android partners in the sub-saharan africa (ssa) region.know the user. know the magic. connect the two. at its core, marketing at google starts with technology and ends with the user, bringing both together in unconventional ways. our job is to demonstrate how google's products solve the world's problems--from the everyday to the epic, from the mundane to the monumental. and we approach marketing in a way that only google can--changing the game, redefining the medium, making the user the priority, and ultimately, letting the technology speak for itself.responsibilitiesdefine and execute go-to-market strategies and organizational coordination for feature/product launches including positioning, naming, external communications, competitive analysis, and feature prioritization.develop marketing plans for android in ssa and execute campaigns (co-marketing and owned) to drive usage of google workspace. work with the business development team to co-market with telcos and oem partners.define retail marketing strategy for android in ssa, including always-on retail training programs, sales incentive programs, point-of-sale marketing, and other customer facing experiences. develop methods to track effectiveness of retail strategy through measurement and customer research.use quantitative methods, models, and research to help google better understand consumer behavior to provide important feedback back into the product and strategic development cycle. determine return on investment for projects.google is proud to be an equal opportunity workplace and is an affirmative action employer. we are committed to equal employment opportunity regardless of race, color, ancestry, religion, sex, national origin, sexual orientation, age, citizenship, marital status, disability, gender identity or veteran status. we also consider qualified applicants regardless of criminal histories, consistent with legal requirements. see also google's eeo policy and eeo is the law. if you have a disability or special need that requires accommodation, please let us know by completing our accommodations for applicants form .",Google,Lagos,"ma, bachelor, mea, mpa, ma, nce","Marketing skills, UX design, brand management, A/B Testing, communication skills"
127,Account Manager,"never miss a job update again. company: location: nigeriastate: job type: full-time job category:  job descriptionfadac resources and services – our client is a large consumer durable distribution conglomerate with more than 3000+ trade partners across the country. her business model goes beyond fulfillment to provide our customers and suppliers a unique combination of operational excellence and service efficiency.due to expansion, they are recruiting to fill the position below:job title: account managerlocation: lagosemployment type: full-timejob responsibilitiesstandard vs actual materials consumption comparisonraw-materials accuracy – physical verification on or before 4th of every monthdaily production entry comparison with production recordsall employee ledgers monthly reconciliationsupporting fc on bidding tracking for prices and contractsscrutinization of all ledger and escalated the observation to fcperiodical review of bill of material and make amendment if requiredmake schedule for balance sheet itemsreconciliation of general ledgers. job requirementsb.sc in accountingpost graduate degree / ican certification is an added advantage5 – 6 years working experience in similar position within the fmcg industry.should be smart and good communication skill both spoken and writtenshould have good knowledge of accounting skills.application closing date30th november, 2021.don't keep! kindly share:",Fadac Resources and Services,Lagos,"ma, b.sc, ond, mpa, nce","general ledger, account management, strategic thinking and planning, negotiation skills, Excel and data analysis"
143,Software Engineer,"we are looking to hire an entry level software engineer to be a part of our team of talented developers. as the graduate trainee you will work alongside the software engineers and product manager to ensure the delivery of effecting results in the projects you will be handling.responsibilitiesdevelop quality software and web applicationsanalyze and maintain existing software applicationsdiscover and fix programming bugsimproving system quality by identifying issues and common patterns, and developing standard operating proceduresenhancing applications by identifying opportunities for improvement, making recommendations and designing and implementing systemsmaintaining and improving existing codebases and peer review code changesliaising with colleagues to implement technical designsinvestigating and using new technologies where relevantproviding written knowledge transfer materialqualificationsbachelor's degree or equivalent experience in computer science or related fielddevelopment experience with programming languages such as php laravel, react native, java and relational databases (myssql) and noql datavases (mongodb)must currently be serving or just completed service year (nysc)",SFS Capital,Lagos,"ma, bachelor, nce","object oriented programming, strategic planning and thinking, problem solving, software development, software testing and debugging"
147,Nigeria Administration & Procurement Manager,"job title: administration & procurement managerdepartment: finance & administrationreporting line: head of finance & administrationlocation: lagos, nigeriaabout engie energy accessengie energy access is one of the leading pay-as-you-go (paygo) and mini-grids solutions provider in africa, with a mission to deliver affordable, reliable and sustainable energy solutions and life-changing services with exceptional customer experience. the company is a result of the integration of fenix international, engie mobisol and engie powercorner; and develops innovative, off-grid solar solutions for homes, public services and businesses, enabling customers and distribution partners access to clean, affordable energy. the paygo solar home systems are financed through affordable installments from $0.19 per day and the mini-grids foster economic development by enabling electrical productive use and triggering business opportunities for entrepreneurs in rural communities. with over 1,700 employees, operations in 9 countries across africa (benin, cote d'ivoire, kenya, mozambique, nigeria, rwanda, nigeria, uganda and zambia), over 1.2 million customers and more than 6 million lives impacted so far, engie energy access aims to remain the leading clean energy company, serving millions of customers across africa by 2025.www.engie-energyaccess.comjob overviewthis position will be part of the finance & admin team that is based in lagos, nigeria, led by the head of finance & admin. the position holder will lead, manage and coordinate administrative and procurement functions and ensure that the office runs smoothly and procurement management is cost effective.key responsibilities, deliverables and activitiessupervise all activities of the admin departmentprovide reports to management on regular basis on the activities managed and cost cutting initiatives.monitor, supervise and ensure safety measures are incorporated into all business office developmentpotential activities and projectssupervise all activities of the administration departmentmonitor various activities and service/maintenance contractscoordinate and management of all administrative issues like hygiene, stationeries, & welfaresupervise all maintenance activities and maintain a regular maintenance scheduleestablish the slas for all service providers and suppliers and monitor compliance.ensure insurance policy is adhered to at all premises and premium charges paid promptlydevelop adequate records of fleet management/movement, and put in place policies/structures to guard against abuseenforce proper management and efficient utilization of storesdeliver all admin services in the most efficient manner to facilitate the functions of other departmentstrain administration staff on best practicesachieve cost savings wherever possible by negotiating and identifying legitimate vendors.prepare purchase proposals for equipmentrequired skills & experiencediploma / degree in business / administrationat least 7 years' working experience in administration with at least 2 years experience in a managerial position.experience in financial analysis and decision makingexperience in managing contracts with various vendors and ensuring slas are adhered toexcellent computer skillsgood communication skills (both written and verbal)self-motivated with the ability to meet project deadlinesdesired skills & experiencestrong ability in planning and organization.team player and dynamic self-starter.good communicator with a relational easedetail-oriented and deadline drivenethical team player who can work under pressuremanager expectationsat eea, we have high expectations for our managers. each manager plays a key role in creating an exceptional experience not only for our customers but for every person on our team. our managers help eea realize our ambitious goals while developing their own leadership skills and facilitating growth for their direct reports.we believe that great managers:get things done, and are highly productive and results-orientedempower their team members to own their work and challenge them to achieve more than they thought possiblecommunicate and collaborate effectively both within and across teams, listening and sharing informationknow and care about their team members, help them to use their strengths at work, invest in their professional development, and prioritize feedbacklive by the company values and mission, lead others to do the same, and create an inclusive and equitable environmentmake the vision and strategy clear, and translate them into clear plans and expectations for the team and team members operate transparently and with accountability, and hold others accountablewe thank all applicants for their interest, however due to the large volume of applications we receive, only shortlisted candidates will be contacted.engie is an equal opportunity employer, promoting diversity and committed to creating an inclusive environment for all. all applications are screened based on business needs, job requirements and individual qualifications, without any regard to origin, age, name, sexual identity, orientation or preference, religion, marital status, health, disability, political opinions, union involvement or citizenship. our differences are our strengths!",ENGIE Energy Access (Africa),Lagos,"ma, mea, mpa, n cre, ma, nce","Negotiation skills, project management skills, economic analysis, supply chain management, analytical skills"
