,Title,Job Description,Compnay Name,Location,Degree Type,Skills
42,Trainee Industrial,"área de atuaçãoindustriallocalizaçãodelta-mgatribuiçõesempresa de sucroenergia contrata para cargo de trainee industrial em delta (centro) para atuar em tempo integral, comercial.desenvolver, reter e disseminar o conhecimento técnico para a equipe. padronizar procedimentos, garantindo otimização dos processos. melhoria continua da performance industrial, analisando oportunidades de ajuste de pessoal e estrutural para produzir mais. acompanhar os indicadores de desempenho, realizando comparativo de cenários e evolução dos processos. analisar rotina de trabalho da filial de grãos, padronizar e checar procedimentos de amostragem, criando documentação padrão a ser seguida.é oferecido contrato trainee,beneficios a combinar /vaga códrequisitos:ensino superior completoescolaridade mínima exigidasem informação",Expresso Vagas,Delta,"ma, mpa, mga, nce","MS word, Powerpoint, Excel, Wordpress, use basic engineering tools"
43,OPERATIONS/ADMIN MANAGER,"the ideal candidate will be responsible for overseeing all areas of the business including executive support to the md, administration and business operations functions. in order to succeed in this role, you must be able to use your initiative, be hands-on, be able to manage projects effectively and be able to work smartly. responsibilitiesresponsible for overseeing and maintaining the day-to-day operationsprovide high-level administrative and executive support to the md/ceo, manage his calendar, follow him to meetings, prepare executive reports and presentations, etc.assist the md/ ceo in setting goals and making sure they are implemented.coordinate the administrative workflow, manage routine correspondence (email, calls, etc.) and other administrative and operational duties.anticipate problems and recommend ways to resolve them and help the md achieve sharp gains in productivity and impact.ensure the profitability of the company’s activities by following up on projects and ensuring they are done effectivelymaintain relationships with partners/vendors/suppliers/clientsmanage projects and manage the relationships and communication with project coordinatorsqualificationsbachelor's degree or equivalent3+ years of relevant work experiencerequires reasoning ability and good independent judgmentstrong organisational and administrative skills for managing and implementing plansstrong problem solving and critical thinking skillsoutstanding communication and interpersonal abilitiesthorough researchertechnologically savvy, excellent knowledge of ms office applications",A client of The CVM Career Company,Lagos,"ma, bachelor, ond, mpa, ma, nce","project management, delegation, flexibility, risk management, cost reduction strategies"
45,Secretary/Personal Assistant,"never miss a job update again. company: location: nigeriastate: job type: full-time job category:  job descriptionfadac resources and services – our client is a large consumer durable distribution conglomerate with more than 3000+ trade partners across the country. her business model goes beyond fulfillment to provide our customers and suppliers a unique combination of operational excellence and service efficiency.due to expansion, they are recruiting to fill the position below:job title: secretary / personal assistantlocation: lagosemployment type: full-timeresponsibilitiesanswer calls, take messages and handle correspondence.maintain diaries and arrange appointments for the gm.type, prepare and collate reports.organising and servicing meetings, ensuring that agendas are available and taking minutes.managing databases and files.implement new procedures and administrative systems.liaise with relevant organisations and clients.keep basic financial records.act as a receptionist and/or meeting and greeting clients.perform other duties as required.requirementsat least 3 years’ experience in secretarial and pa positions.minimum of a degree in a relevant field.proactive and able to take initiative.excellent communication skills, both oral and verbal.great interpersonal skills.customer service and relationship-building skills.team working skills.organisation and time management skills.ability to use standard software packages (eg microsoft office) and to learn bespoke packages if required.application closing date31st august, 2021.don't keep! kindly share:",Fadac Resources and Services,Lagos,"ond, mpa, ma, nce","Microsoft office applications, communication skills, accounting skills, research skills, project management tools."
46,Receptionist & Cashier,"never miss a job update again. company: location: nigeriastate: job type: full-time job category:  job descriptionde santiago milan hotel and suites is a top-class luxury hotel with elegant and glamour. starting from the lobby of the hotel to the elegantly finished rooms, the interior provide a comfortable and unmatched experience. our hotel is primed for corporate, business and leisure travelers, offering superior services and excellent facilities.we are recruiting to fill the following positions below barman female receptionist & cashier security kitchen assistantlocation: amuwo odofin, lagosemployment type: full-timegeneral requirementsinterested candidates should possess an ond qualification4 – 10 years of relevant work experience.applicant must be a residence of amuwo – odofin and its environs.application closing date29th october, 2021.don't keep! kindly share:",De Santiago Milan Hotel and Suites,Lagos,"ond, mpa, ma, nce","Basic Maths skills, Product knowledge, Loss Prevention technique, Interpersonal communication, Customer service."
48,REVENUE MANAGER,"ibis hotel""some say you can't put a price on comfort."" ibis hotels prove the contrary by offering their guests well-being at the best price. fully-equipped rooms, innovative bedding and 24-hour reception services. welcome to the world’s leading economy hotel brand.ibis is a brand of economy hotels focused on evolutive design with simple and flexible furniture and owned by accor. created in 1974, ibis became accor's economy megabrand in 2011 with the launch of ibis styles and ibis budget. ibis manages 1174 hotels in 67 countries (2018)job descriptionsupport the hotel management (or the director of revenue) to define the hotel strategy (in terms of business mix and pricing by season and type of day) for the future periods – the initial annual forecastanalyze the hotel(s) results and performance (average rates, occupancy rates, revpar..). survey the market and competitors in terms of performance (revpar index, market penetration…), pricing and availability as a basis for future tactical decisions with the hotel(s) gms.ensure an accurate and dynamic forecast for the future dates (by room and revenue by segment and day) based on the rm referenced systems recommendations and a daily monitoring of the data (portfolio, booking pick-up, events, calendar events).take daily decisions to optimize the hotel turnover. decisions in terms of pricing, inventory management (rmls open/close), group quotation, distribution channels... ensure that his/her recommendations are implemented in reservation and reception, and that systems (pms, tars, rms) are updated accordingly.ensure that a “rm culture” is spread in the hotel, through the animation of weekly yield meetings (gathering the gm and the keyhotel managers) and regular coaching and training sessions for the hotel teamsjob purposewithin the framework of the hotel strategy, is in charge to implement and use rm methods, processes, tools in one or several hotel (s) (maximum 4) in order to maximize the turnover.key ineractionsinternally: hotel teams, sales, front desk, reservation rm network (hotel/place/region) of his areamain complexity lots of data and statistics to deal with, coming from different sources (pms, tars, rms, excel shared tools, market and distribution data files)requires a mix of analytical and communication skills on a daily basisneed to keep a good balance between the “urgency” of hotel operations and the long term anticipation required for the designing the strategycompetenciespersonal : the ideal candidate for this role should be;result / performance orientedproactive with analytical and conceptualization skillsstrategic and persuasiveexternal and internal environment understandingcustomer focusedable to provide leadership and team supporttechnical : -must be able to speak and write in english language (and local language if needed)proven professional experience in revenue management from 6 months to 1 year (internship or job) completed by a reception/reservation experience.proficient in the use of revenue management systems (rms), excel & powerpoint, hotel systems (pms, tars)possess working knowledge of revenue management techniques, calculations and indicatorsprofiledegree in hotel management or business schoolexperience working in the hospitality industryability to communicate in french language will be an added advantage",IBIS,Lagos,"ma, ma, nce"," Microsoft Excel, Powerpoint, Sales report, Central Reservation system, Analytics"
49,Nutrition Specialist,"never miss a job update again. company: location: nigeriastate: job type: full-time job category:  job descriptionunited nations international children’s emergency fund (unicef) works in some of the world’s toughest places, to reach the world’s most disadvantaged children. to save their lives. to defend their rights. to help them fulfill their potential. across 190 countries and territories, we work for every child, everywhere, every day, to build a better world for everyone.we are recruiting to fill the following positions below nutrition specialist (national food consumption and micronutrient survey), p-3 location: abujadeadline: 14th november, 2021. national consultant for wash in emergency sector technical working group location: abujadeadline: 9th november, 2021. communication for development specialist – nericc location: abujadeadline: 14th november, 2021. nutrition specialist, no-3 location: abujadeadline: 8th november, 2021.don't keep! kindly share:",United Nations International Children’s Emergency Fund (UNICEF),Abuja,mpa,"Research translation, Tech savvy, Organisation, Active learning, Decision making"
50,Public Health Administrative Management Assistant at the U.S. Embassy,"never miss a job update again. company: location: nigeriastate: job type: full-time job category:  job descriptionthe u.s. mission to nigeria comprises of the embassy in abuja, fct, and the consulate general in lagos. u.s. consulate general lagos is the mission’s representative to the nigerian people in the southern region.we are recruiting to fill the position belowjob title: public health administrative management assistantannouncement number: abuja-2021-109location: abujahiring agency: embassy abujaseries / grade: le – 0540 9promotion potential: le-9work schedule: full-time – 40 hours per weektelework eligible: nooverview hiring path: open to the publicwho may apply/clarification from the agency:for usefm – fp is 05 (steps 1 – 4).actual fp salary is determined by washington d.c.all interested applicants / all sourcessecurity clearance required: public trust – background investigationappointment type: permanentappointment type details: indefinite subject to successful completion of the probationary periodsummarythe work schedule for this position is: full time (40 hours per week)start date: candidate must be able to begin working within a reasonable period of time (6 weeks) of receipt of agency authorization and/or clearances/certifications or their candidacy may endsupervisory position: norelocation expenses reimbursed: notravel required: not requireddutiesbasic functionunder the supervision of the snr financial management specialist who serves as the lead for budget and finance, the budget analyst provides technical expertise in the budget, financial management, audit, and partner financial reviews to support efficient operations to meet u.s. government financial, procurement, and cooperative agreement objectives.the incumbent implements systems to manage funds and internal financial controls for intramural and extramural funds to ensure the efficient use of financial resources.participates in the formulation of program and administrative operating budgets and conducts general and specific assessments and financial analyses of cdc nigeria financial data and reports.requirementsqualifications and evaluationsexperienceminimum of five (5) years of progressively responsible work experience in accounting, auditing, or financially oriented business management. of these, 3 years experience as an auditor of an international or a non-governmental organization is required.job knowledgedetailed and thorough knowledge of the theory and practice of accounting is required.knowledge of generally accepted accounting principles and standards and knowledge of government auditing standards is also required.thorough knowledge of budget development, execution, and analysis, including technical procedures and methods of budgeting, computing and reporting for financial programs is required.must have knowledge of the principles of the employing organization’s payroll budget formulation and management procedures.education requirementsa bachelor’s degree or equivalent in accounting, business administration, economics, auditing or finance is required.nysc certificate or exemption document is required.evaluationsthis may be tested. please specify your level of proficiency in the language listed.languagefluent speaking/reading/writing in english is required.skills and abilitiesincumbent must be able to work with limited supervision to assess inconsistencies in complex financial data and to collaborate with technical staff in the preparation of budgets for technical projects.the incumbent must have excellent analytical skills and be highly innovative to achieve greater financial and operational efficiency.incumbent must possess advanced computer skills with experience using word processing and spreadsheets; and be able to use cdc iris financial software, dos coast financial software, and usg pms (payment management system).accuracy and speed are required. incumbent must have an intermediate level of experience in data analysis and data entry.equal employment opportunity (eeo)the u.s. mission provides equal opportunity and fair and equitable treatment in employment to all people without regard to race, color, religion, sex, national origin, age, disability, political affiliation, marital status, or sexual orientation.qualificationsall applicants under consideration will be required to pass medical and security certifications.benefitsbenefits and other infoagency benefitslocally employed staff, including members of household (mohs), and third-country nationals (tcns), working at the u.s. mission in abuja, nigeria may receive a compensation package that may include health, separation, and other benefits.for efms, benefits should be discussed with the human resources office.the pay plan is assigned at the time of the conditional offer letter by the hr office.other informationhiring preference selection process:applicants in the following hiring preference categories are extended a hiring preference in the order listed below.therefore, it is essential that these applicants accurately describe their status on the application.failure to do so may result in a determination that the applicant is not eligible for a hiring preference.importantapplicants who claim status as a preference-eligible u.s. veteran must submit a copy of their most recent dd-214 (“certificate of release or discharge from active duty”), equivalent documentation, or certification. a “certification” is any written document from the armed forces that certifies the service member is expected to be discharged or released from active duty service in the armed forces under honorable conditions within 120 days after the certification is submitted by the applicant. the certification letter should be on letterhead of the appropriate military branch of the service and contain (1) the military service dates including the expected discharge or release date; and (2) the character of service. acceptable documentation must be submitted in order for the preference to be given.** this level of preference applies to all foreign service employees on lwop and cs with re-employment rights back to their agency or bureau.for more information (i.e., what is an efm, usefm, aefm, moh, etc.?) and for additional employment considerations, please visit the following link.marketing statementwe encourage you to read and understand the eight (8) qualities of overseas employees before you apply.salaryngn 10,908,677 (usd 47,619) annually.application closing date15th november, 2021.don't keep! kindly share:",U.S. Embassy,Abuja,"ma, bachelor, ond, mba, mma, mpa, ma, nce","Electronic record systems, use of advanced medical equipments, analytical skills, collaboration skills, leadership skills"
51,Software Testers/IT Help Desk,"company descriptionour client is a global leader in logistics and transport management. they have adopted the most efficient cargo handling processes, employing cutting-edge technology solutions, to achieve minimal delay in vessel operations, optimal utilization of terminal area, and the fastest delivery of the cargo. they seek passionate and talented software testers/it help desks to join their team.job descriptionsoftware tester duties include:perform activities pertaining to integration and factory acceptance testing including identifying, documenting, and communicating all issues or defects discovered during test case development and executionwork closely with developers and subject matter experts to prepare test cases, test data, determine expected results, and communicate/resolve issues and defects identifiedwork with testing resources and subject matter experts to gain a functional understanding of the application and associated business processesresearch unexpected results to identify root causes and report results accordingly helpdesk lead duties includeassist with system support and troubleshooting of a customs warehouse systeminteract with customers via phone and email in a professional mannerquickly and accurately document caller's contact information, site, key data, and nature of the problem in the ticketing systemrespond to tickets and answer calls within the contractually defined timeframesserve as the customer liaison and address any issues or concernsraise any concerns to manager that cannot be resolved in a timely manner qualifications2 to 3 years of customer contact experience and/or software testingexperience with automated testingpersistence at digging into complex issues with imperfect informationbackground in software testing, debug and research/investigation of software issuesability to read software requirements and create written test plansexcellent written and verbal skillsworks with microsoft office applications and/or google docs suiteknowledge of source control workflow (git)database experience (postgresql, db2, and redis)desire to share learnings in team training sessions and mentor other team membersbackground in supply chain execution (sce) systems (warehousing, transportation, manufacturing, etc.)committed, reliable, organized team player with effective time management and prioritization skillsexcellent interpersonal skills-able to communicate effectively with employees and executives; high degree of patience with people and processes.enjoy solving challenging problemsself-driven to continue learning new concepts, software systems, tools, and technologycontribute to documentation to improve team knowledge of new and existing software features and test methodologieswork independently with minimal supervisionenjoys exploratory testing and learningadditional informationremuneration is competitive along with other benefitsthe deadline for submission is november 30, 2021. interviews are on a rolling basis to this date. only shortlisted candidates will be contacted.further assessments will be required.",Myrtle Management Consultants,Lagos,"ma, ond, mpa, ma, nce","DevOps and Agile methodology, Rational analysis and Logical thinking, Testing tools and techniques, Common programming language, Software development life cycle."
53,DIGITAL MARKETING EXECUTIVE,"ibis is an international hotel company owned by accorhotels, a hotel holding company. accorhotels is listed on the paris stock exchange and was founded in 1967. ibis opened its first hotel in 1974. the hotels are generally close to city centres, airports, beaches or railway stations.we are recruiting to fill the position belowjob title: digital marketing executiveresponsibilitiesdevising strategies to drive online traffic to the company website.tracking conversion rates and making improvements to the website.developing and managing digital marketing campaignsutilising a range of techniques including paid search, seo and ppc.overseeing the social media strategy for the company.managing online brand and product campaigns to raise brand awareness.managing the redesign of the company website.improving the usability, design, content and conversion of the company websiteresponsibility for planning and budgetary control of all digital marketingevaluating customer research, market conditions and competitor data.review new technologies and keep the company at the forefront of developments in digital marketing.requirementsbachelor’s degreeminimum of 3 years’ experience in digital marketingexperience managing ppc, seo and affiliate programmesstrong understanding of current online marketing concepts, strategy and best practice.experience in ecommerce, seo, ppc, email marketing, and social media.previous experience in a similar digital marketing role in a luxury hotel.graphic design skills: adobe creative suiteweb design skills will an added advantage.benefitsattractive salary: our goal is to acknowledge our employees' skills and performance, while at the same time respecting the principles of fairness and non-discrimination.regular support: meeting in a calm setting, conducting an appraisal, and setting targets is a valuable process, both for managers and employees. several meetings or discussions are held throughout the year to facilitate dialogue and motivate teams.wellness for all: with operations over 63 countries, we strive to ensure the well-being, health, and safety of all our teams. accor is extremely attentive to its employees and their loved ones.",IBIS,Lagos,"ma, bachelor, ond, mpa, nce","Wordpress, Google Ads, SEO Blogging, Keyword research, Data analysis"
54,Executive Assistant,"never miss a job update again. company: location: nigeriastate: job type: full-time job category:  job descriptionfadac resources and services – our client is a large consumer durable distribution conglomerate with more than 3000+ trade partners across the country. her business model goes beyond fulfillment to provide our customers and suppliers a unique combination of operational excellence and service efficiency.due to expansion, they are recruiting to fill the position below:job title: executive assistantlocation: lagosemployment type: full-timejob responsibilitiesact as the point of contact among executives, employees, clients and other external partnersmanage information flow in a timely and accurate mannerprovide a bridge for smooth communication between the president’s office and internal departments; demonstrating leadership to maintain credibility, trust and support with senior management staffmanage executives’ calendars and set up meetingsformat information for internal and external communication – memos, emails, presentations, reportsresearch, prioritize, and follow up on incoming issues and concerns addressed to the md, including those of a sensitive or confidential nature. determine appropriate course of action, referral, or responsework closely and effectively with the ceo to keep him/her well informed of upcoming commitments and responsibilities, following up appropriatelysuccessfully complete critical aspects of deliverables with a hands-on approach, including drafting acknowledgement letters, personal correspondence, and other tasks that facilitate the md’s ability to effectively lead the companyjob requirementsminimum of 3 years’ experience as an executive assistant, personal assistant or similar roleminimum of b.sc / b.a.excellent ms office knowledge.outstanding organizational and time management skills.ability to perform and prioritize multiple tasks seamlessly with excellent attention to detail.familiarity with office gadgets and applications.excellent verbal and written communications skills.problem-solving and decision making.proactivity and self-direction.excellent interpersonal skills.discretion and confidentiality.application closing date31st august, 2021.don't keep! kindly share:",Fadac Resources and Services,Lagos,"ma, b.sc, ond, mpa, n cre, ma, nce","Email management, Collaboration tools(Slack, Gsuite), Information management, Microsoft office tools, Correspondence"
